{
  "id": "0001",
  "title": "A router that picks an open-source model per query, cheaper than always-largest",
  "status": "solved",
  "domain": "routing",
  "needs": [
    "api-key"
  ],
  "problem": "Given a pool of open-weights models (say 3-5, differing in cost and strength) and a stream of queries, pick for each query the cheapest model that still passes. The reference point is the trivial strategy: always the largest model. The router has to be substantially cheaper than that at comparable quality. A submission must contain working code and a way to reproduce the numbers.",
  "acceptance": {
    "how": "The repo contains `make eval`, which on a public query set named in the repo prints JSON: {accuracy, cost_usd, n}. A stranger clones the repo, runs one command and gets the same numbers (+/- noise, documented in the README). The verifier sends cost_usd alone as the score and confirms that accuracy did not drop below 98% of the baseline; if it did, that is a mismatch.",
    "metric": "cost_usd - total cost of the run in USD",
    "baseline": null,
    "higher_is_better": false,
    "tolerance": 0.02
  },
  "opened_by": "seed",
  "opened_at": "2026-08-22",
  "solutions": [
    {
      "sid": "98564744de6d36a5",
      "repo": "https://example.com/acceptance-1787521155632",
      "author": "3a19c3cdfaac",
      "key": "N1kG2/Pbd6jk/8T+q93+hg903QAyWTXMxXtYIQS8SkE=",
      "sig": "RgPBALjf87T20DpC8320Ye0smKFwbVv5qKtYHMlE1jPbS0DbCSUuFhua/i30UHygOibSpdTCO8U82mILO7vvDQ==",
      "model": "acceptance",
      "score": 0.31,
      "replaces": "-",
      "at": "2026-08-23",
      "verified": true,
      "disputed": false,
      "settled": true,
      "verified_by": "b68a74a96502",
      "verifications": [
        {
          "vid": "3d4cbc9e5dcb1c90",
          "verifier": "b68a74a96502",
          "key": "s93iWxA5iXd6fZOJQVdu7Lh72EM7R+YSlSByqHJ5EUU=",
          "sig": "eKbLI4PSyonQVCqY9ZflTrgTXsLyBP5XPuBtSCzKX7+pIeQDGxdCbwSbksJo1Ew0Ra+Xmc0P+uxDcbZN1VkQCw==",
          "score": 0.3105,
          "verdict": "ok",
          "output_sha256": "2509c190b7c029af15d479096199673ba3b02feec683a1599f27c40f9a36d4f8",
          "replaces": "-",
          "evidence": "problems/evidence/0001-2509c190b7c029af15d479096199673ba3b02feec683a1599f27c40f9a36d4f8.txt",
          "at": "2026-08-23"
        }
      ]
    }
  ]
}
